{
  "$schema": "https://json-schema.org/draft/2020-12/schema",
  "$id": "https://puriq.dev/schema/site-config.v1.json",
  "title": "Puriq Site Config",
  "description": "Capa de ESTRUCTURA: qué módulos se activan, su orden, el hero y el destino de deploy. El usuario edita con opciones acotadas.",
  "type": "object",
  "required": ["layout", "modules"],
  "additionalProperties": false,
  "properties": {
    "$schema": { "type": "string" },
    "layout": { "enum": ["clasico", "moderno"] },
    "modules": {
      "type": "object",
      "additionalProperties": false,
      "properties": {
        "map": { "$ref": "#/$defs/module" },
        "places": { "$ref": "#/$defs/module" },
        "events": { "$ref": "#/$defs/module" },
        "blog": { "$ref": "#/$defs/module" },
        "chatweb": { "$ref": "#/$defs/chatModule" }
      }
    },
    "hero": {
      "type": "object",
      "required": ["type", "asset"],
      "additionalProperties": false,
      "properties": {
        "type": { "enum": ["image", "video"] },
        "asset": { "type": "string" },
        "headline": { "type": "string" },
        "subheadline": { "type": "string" }
      }
    },
    "landing": {
      "type": "array",
      "description": "Capa de PORTADA componible: secciones activables, ordenables y editables. Opcional; su ausencia mantiene retrocompatibilidad con el hero heredado.",
      "items": {
        "type": "object",
        "required": ["type", "enabled", "order"],
        "additionalProperties": false,
        "properties": {
          "type": { "enum": ["hero", "features", "cta", "gallery", "stats", "testimonials", "faq"] },
          "enabled": { "type": "boolean" },
          "order": { "type": "integer", "minimum": 1 },
          "content": { "type": "object" }
        }
      }
    },
    "contact": {
      "type": "object",
      "additionalProperties": false,
      "properties": {
        "email": { "type": "string" },
        "phone": { "type": "string" },
        "whatsapp": {
          "type": "string",
          "description": "Numero de WhatsApp en formato internacional (solo digitos, con codigo de pais). El sitio arma el enlace wa.me."
        }
      }
    },
    "deploy": {
      "type": "object",
      "additionalProperties": false,
      "properties": {
        "target": { "enum": ["aws-amplify", "s3-cloudfront", "static-export", "vercel", "netlify"] },
        "domain": { "type": "string" }
      }
    }
  },
  "$defs": {
    "module": {
      "type": "object",
      "required": ["enabled", "order"],
      "additionalProperties": false,
      "properties": {
        "enabled": { "type": "boolean" },
        "order": { "type": "integer", "minimum": 1 },
        "label": { "type": "string" }
      }
    },
    "chatModule": {
      "type": "object",
      "required": ["enabled", "order"],
      "additionalProperties": false,
      "properties": {
        "enabled": { "type": "boolean" },
        "order": { "type": "integer", "minimum": 1 },
        "label": { "type": "string" },
        "display": { "enum": ["floating", "section"], "description": "Cómo se muestra el asistente: 'floating' es un botón burbuja fijo presente en todas las páginas (por defecto); 'section' lo inserta como una sección más de la portada." },
        "persona": { "type": "string", "description": "Tono/personalidad del asistente." },
        "knowledgeSource": { "type": "string", "description": "Ruta a los Q&A que alimentan el RAG." },
        "apiEndpoint": { "type": "string", "description": "URL opcional del proxy RAG (Bedrock). Si se define, el asistente consulta este endpoint; si no, usa recuperacion client-side sobre el FAQ publico." }
      }
    }
  }
}
